scout,match,robot,team,start,show,move,auto_coral_L1_num,auto_coral_L2_num,auto_coral_L3_num,auto_coral_L4_num,robot_reef_removal,robot_algae_picked,robot_net_score,robot_net_miss,proc_score,coral_L1_num,coral_L2_num,coral_L3_num,coral_L4_num,tele_missed,climb_attempt,ending,climb_time,fouls,defense,driver,dead,comments,commentOpen
JA,29,R2,1629,C,FALSE,TRUE,0,0,0,3,FALSE,FALSE,0,0,0,0,0,0,0,0,FALSE,No,FALSE,0,0,1,di,,Good auto but froze during tele op
GL,29,B2,2363,F,FALSE,TRUE,0,0,0,1,TRUE,FALSE,0,0,1,0,0,0,4,0,TRUE,P,FALSE,0,0,3,NA,,Cycles were meh time wise and struggled a bit with algae intake.
GEH,29,R1,8230,M,FALSE,TRUE,0,0,0,0,TRUE,FALSE,0,0,0,1,1,2,0,0,TRUE,D,FALSE,0,0,3,NA,,"Slow cycling, struggled to pick coral up from the ground"
TC,29,R1,836,F,FALSE,TRUE,0,0,0,2,TRUE,TRUE,2,2,0,0,1,4,3,0,TRUE,D,FALSE,0,0,4,NA,7,Very versatile and moderately fast scoring.
GEH,30,R1,8592,F,FALSE,FALSE,0,0,0,3,FALSE,FALSE,0,0,0,0,5,6,5,0,TRUE,D,FALSE,0,0,5,NA,,Amazing performance again. Quick cycles and filled the reef fast.
BH,30,B1,1885,C,FALSE,TRUE,0,0,0,0,TRUE,TRUE,1,1,6,0,0,0,0,0,FALSE,P,FALSE,0,0,4,NA,,
TC,30,R1,977,F,FALSE,TRUE,0,0,0,1,FALSE,FALSE,0,0,0,0,0,0,1,2,FALSE,No,FALSE,0,1,2,ba,0,Their offense had really inconsistent cycles that were slow. They switched to defense early and was okay until they got beached on enemy side.
RX,30,B2,8622,,TRUE,FALSE,0,0,0,0,FALSE,FALSE,0,0,0,0,0,0,0,0,FALSE,No,FALSE,0,0,0,NA,,
Ashwin,30,R3,5338,C,FALSE,TRUE,0,0,0,0,FALSE,FALSE,0,0,0,1,0,3,7,4,TRUE,P,FALSE,0,0,4,NA,,"Consistent with intaking and scoring, but was missing for the last 45 seconds. "
GGK,30,R2,116,M,FALSE,TRUE,1,0,0,0,TRUE,TRUE,6,0,2,0,0,0,0,0,TRUE,D,FALSE,0,0,4,NA,,Carefully placed algae in a super full net; successfully!
TC,31,R1,1086,F,FALSE,TRUE,0,0,0,2,TRUE,FALSE,0,1,0,1,3,3,2,8,FALSE,P,FALSE,0,0,3,NA,,Bad outake accuracy. Fast movement and cycles.
BH,31,B1,1731,C,FALSE,TRUE,0,0,0,3,FALSE,FALSE,0,0,0,3,1,0,3,1,TRUE,D,FALSE,0,0,4,NA,,
RX,31,B2,10224,M,FALSE,TRUE,0,0,0,1,FALSE,FALSE,0,0,1,1,2,3,0,1,TRUE,D,TRUE,0,0,4,NA,,"Did not cycle L4, pretty fast cycling on reef, removed one algae "
GL,31,R2,401,C,FALSE,TRUE,1,0,0,1,TRUE,FALSE,0,0,2,0,2,2,1,0,TRUE,D,FALSE,0,0,4,NA,,"Efficient switching between tasks, though. they missed a few intake opportunities from the reef."
CVC,31,R1,422,F,FALSE,TRUE,0,0,0,3,TRUE,FALSE,0,1,1,3,2,2,1,7,FALSE,S,FALSE,0,0,4,NA,,"Did good, started off strong, started missing quite a bit perhaps due to them attempting to do it a little too quickly. If they had continued at the start pace they maybe wouldn’t have missed as much as they did. They were able to achieve climb quickly and did place a majority of coral on reef, also removed 2-3 algae41386one for processor shot."
Ashwin,31,R3,8726,M,FALSE,TRUE,0,0,0,0,FALSE,FALSE,0,0,0,0,0,0,0,0,TRUE,P,FALSE,1,3,3,NA,"0,2","Did cause opponents to miss some coral intakes from feed, but was closer to the cages than actually defending for some time"
BH,32,B1,1895,M,FALSE,TRUE,0,0,0,0,FALSE,FALSE,0,0,0,0,0,0,4,1,TRUE,S,FALSE,0,0,3,NA,,
GEH,32,R1,6326,F,FALSE,TRUE,0,0,0,0,FALSE,FALSE,0,0,0,0,0,0,0,0,FALSE,P,FALSE,0,5,5,NA,0,Successfully blocked the processor for most of the match and defended the coral station as well. Very good driving
GL,32,R2,611,F,FALSE,TRUE,0,0,0,2,FALSE,FALSE,0,0,0,0,0,0,2,0,FALSE,No,FALSE,0,0,3,NA,,"Disabled for the majority of the match, and got defended hard. Handled defense about as well as possible."
AX,32,B2,614,C,FALSE,TRUE,0,1,0,0,TRUE,FALSE,0,0,1,2,2,0,0,3,FALSE,No,FALSE,0,0,2,NA,,2186 defense + all the fallen coral at loading station slowed down 614 cycles significantly 
TC,32,R1,2186,M,FALSE,TRUE,0,0,0,1,FALSE,FALSE,0,0,0,0,0,0,0,0,TRUE,D,FALSE,0,4,4,NA,,Strong and fast robot defended 2 robots at once for most of the match. Slow auto.
Ashwin,32,R3,4821,C,FALSE,TRUE,0,0,0,0,FALSE,TRUE,0,0,2,0,0,0,0,0,TRUE,D,FALSE,0,0,2,NA,,"Kept on being defended, took at least a minute to put algae in processor "
GEH,33,R1,2106,C,FALSE,FALSE,0,0,0,3,TRUE,FALSE,2,0,0,0,0,3,6,0,FALSE,P,FALSE,0,0,5,NA,,"Speedy cycles, great at L4 and algae in the net."
TC,33,R1,2199,M,FALSE,TRUE,0,0,0,1,TRUE,FALSE,2,1,0,0,0,6,2,1,TRUE,D,FALSE,0,0,4,NA,,Very fast cycles
BH,33,B1,2534,F,FALSE,TRUE,0,0,0,0,TRUE,FALSE,0,0,0,0,0,0,0,0,FALSE,P,FALSE,0,0,2,NA,,Got an algae stuck in the bot 
GL,33,R2,5804,F,FALSE,TRUE,0,0,0,3,TRUE,FALSE,0,0,0,0,0,3,6,0,TRUE,D,TRUE,0,0,4,NA,,"Smooth cycling, but algae removal left a little to be desired. Also popped an algae."
Ashwin,33,R3,6213,C,FALSE,TRUE,0,0,0,0,FALSE,FALSE,0,0,0,0,0,0,0,0,FALSE,No,FALSE,1,3,3,NA,0,"Did mess up 339 during feed intakes quite a bit, but pretty much did nothing to 2106"
AX,33,B2,339,M,FALSE,TRUE,0,0,0,0,FALSE,FALSE,0,0,0,0,1,0,0,2,TRUE,No,FALSE,0,0,2,NA,5,"Loading coral took 7+ attempts, coral frequently dropped, coral alignment took 10+ seconds"
BH,34,B1,4541,M,FALSE,TRUE,0,0,0,0,FALSE,FALSE,0,0,0,1,0,0,4,1,FALSE,P,FALSE,0,0,3,NA,,
JJ,34,B3,3748,F,FALSE,TRUE,0,2,0,0,TRUE,TRUE,0,0,1,1,1,4,0,1,TRUE,D,TRUE,0,0,3,NA,4,"Algae GI broke, algae knockoff slow"
AY,34,B2,4505,M,FALSE,TRUE,0,0,0,0,FALSE,FALSE,0,0,0,2,0,0,5,2,FALSE,No,FALSE,0,0,2,NA,,
TC,34,R3,122,F,FALSE,TRUE,0,0,0,0,FALSE,FALSE,0,0,0,3,1,1,5,1,TRUE,D,FALSE,0,0,3,NA,2,Slow first cycle. 
KO,34,R2,3359,M,FALSE,TRUE,0,0,0,0,TRUE,FALSE,1,0,1,0,0,0,0,0,FALSE,P,FALSE,0,0,2,NA,,"Slow driver, poor algae manip"
GL,34,R1,1727,C,FALSE,TRUE,0,1,0,0,TRUE,FALSE,0,0,0,3,5,7,0,1,TRUE,D,FALSE,0,0,5,NA,,Smooth cycles and never got in the way of the alliance.
BH,35,B1,620,C,FALSE,TRUE,1,0,0,2,TRUE,FALSE,1,0,0,1,4,4,5,0,FALSE,No,FALSE,0,0,4,NA,,
KO,35,R2,540,M,FALSE,TRUE,0,0,0,1,FALSE,FALSE,0,0,0,0,4,5,4,2,FALSE,P,FALSE,0,0,4,NA,,"Fast elevator, wide intake "
JJ,35,B3,3373,F,FALSE,TRUE,0,0,0,1,FALSE,FALSE,0,0,0,0,0,2,4,1,TRUE,No,TRUE,0,0,3,NA,,Really slow elevator
BP,35,B2,6863,M,FALSE,TRUE,0,0,0,0,FALSE,FALSE,0,0,0,0,1,4,0,1,FALSE,No,FALSE,0,0,3,NA,,
GL,35,R1,4638,F,FALSE,TRUE,0,0,0,2,FALSE,FALSE,0,0,0,0,1,0,4,1,FALSE,P,FALSE,0,0,3,cs,,"Potential for 3 pc auto, and can remove algae, but it took a long time and was ultimately unsuccessful. Overall cycles were quick though."
TC,35,R3,6802,C,FALSE,TRUE,0,0,0,1,TRUE,TRUE,4,0,0,0,0,0,0,0,FALSE,P,FALSE,0,0,3,NA,,Slow positioning for intake.
BP,36,B2,5116,M,FALSE,FALSE,0,0,1,0,TRUE,FALSE,0,0,0,0,0,0,0,0,TRUE,D,TRUE,0,3,3,NA,"5,0",
JJ,36,B3,888,F,FALSE,FALSE,0,0,0,1,TRUE,FALSE,0,0,2,0,0,0,8,1,FALSE,No,FALSE,0,0,4,NA,,Innacurate autos
KO,36,R2,1908,F,FALSE,TRUE,0,0,0,1,FALSE,FALSE,0,0,0,0,0,1,7,0,TRUE,D,FALSE,0,0,3,NA,,"I might have missed 1-2 teleop corals, they missed 1 auto L4"
AA,36,B1,449,C,FALSE,TRUE,0,0,0,0,FALSE,FALSE,0,0,0,0,7,9,0,0,TRUE,D,FALSE,0,0,4,NA,,
TC,36,R3,539,C,FALSE,TRUE,1,0,0,0,TRUE,FALSE,0,0,2,0,2,3,0,1,FALSE,P,FALSE,0,0,3,NA,,Outake intro processor slow.
GL,36,R1,3793,M,FALSE,TRUE,1,0,0,0,FALSE,FALSE,0,0,0,0,5,3,0,0,FALSE,P,FALSE,0,0,3,NA,,"Good cycles, but felt slower than some other teams. Had some trouble with dropping coral."
BP,37,B2,836,C,FALSE,TRUE,0,0,0,3,FALSE,FALSE,0,0,0,0,0,0,0,0,FALSE,No,FALSE,0,4,4,di,,Disabled after auto
BH,37,B1,977,M,FALSE,TRUE,0,0,0,1,TRUE,FALSE,0,0,0,1,0,2,5,0,FALSE,P,FALSE,0,0,4,NA,,They were trying to climb but they trouble latching onto a moving cadge 
JJ,37,B3,686,F,FALSE,TRUE,0,0,0,0,TRUE,FALSE,1,0,0,1,0,1,2,2,TRUE,D,TRUE,0,0,2,NA,,"Really indecisive about where to place coral, wasted a lot of time"
KO,37,R2,1629,C,FALSE,TRUE,0,0,0,3,TRUE,FALSE,1,0,0,1,2,4,2,4,FALSE,P,FALSE,0,0,4,NA,,"Dropped 1 coral which fell into L1, unclear whether parked, they played fast but inaccurately"
TC,37,R3,116,M,FALSE,TRUE,0,0,0,0,TRUE,FALSE,4,0,2,0,0,0,0,0,FALSE,P,FALSE,0,0,3,NA,5,Auto missed processor shot.
GL,37,R1,9072,F,FALSE,TRUE,0,0,0,1,TRUE,FALSE,3,0,0,0,0,6,6,0,TRUE,P,FALSE,0,0,5,NA,7,"Fast cycles and never got in the way, even while clearing algae for net. Felt like they had a lack of pieces sometimes (human player?)."
BH,38,B1,1111,M,FALSE,TRUE,0,0,0,1,FALSE,FALSE,0,0,0,0,0,0,0,0,FALSE,No,FALSE,0,4,0,NA,0,Pieces fell of the robot mid match.
BP,38,B2,5338,C,FALSE,TRUE,0,0,0,1,FALSE,FALSE,0,0,0,0,0,3,8,3,FALSE,P,FALSE,0,0,4,NA,1,
JJ,38,B3,2890,F,FALSE,TRUE,0,0,0,0,TRUE,FALSE,0,0,0,0,1,0,1,1,FALSE,No,FALSE,0,0,1,NA,2,Algae knockoffed slowly and unnecessarily 
KO,38,R2,8726,F,FALSE,TRUE,0,1,0,0,TRUE,FALSE,0,0,0,0,1,6,0,0,FALSE,P,FALSE,0,0,3,NA,,Unclear whether parked 
GL,38,R1,10224,M,FALSE,TRUE,0,0,0,1,FALSE,FALSE,0,0,0,0,0,0,4,0,TRUE,D,FALSE,0,0,3,NA,,Locked down really hard by 1111 defense. Could41391ve maybe made some better choices to escape?
TC,38,R3,4821,C,FALSE,TRUE,0,0,0,0,TRUE,FALSE,0,0,5,0,0,0,0,0,FALSE,P,FALSE,0,0,3,NA,,Outake for coral bad. Slow positioning for algae intake and outake.
JJ,39,B3,1895,M,FALSE,FALSE,0,0,0,0,TRUE,FALSE,0,0,0,0,0,4,4,0,TRUE,S,FALSE,0,0,2,NA,"1,2",
BH,39,B1,2363,F,FALSE,TRUE,0,0,0,1,TRUE,FALSE,0,0,0,1,0,0,3,1,TRUE,D,FALSE,0,0,3,NA,,
KO,39,R2,1418,C,FALSE,TRUE,0,0,0,2,TRUE,FALSE,0,0,0,1,0,0,7,0,TRUE,D,FALSE,0,0,3,NA,,Missed 1 coral during teleop which fell into L1
AY,39,B2,1086,C,FALSE,TRUE,0,0,0,2,FALSE,FALSE,0,0,0,0,0,1,0,5,FALSE,P,FALSE,0,0,2,NA,,
TC,39,R3,6326,F,FALSE,TRUE,0,0,0,0,TRUE,TRUE,2,1,0,0,0,0,0,0,FALSE,No,FALSE,0,0,2,NA,2,Bot froze at the end for quite some time.
GL,39,R1,6213,M,FALSE,FALSE,0,0,0,0,FALSE,FALSE,0,0,0,0,0,0,0,0,FALSE,P,FALSE,0,4,3,NA,,"Drivetrain defense. Zoned well at the start, but once they started contacting other bots, maybe due to weight issues, they didn41391t do a good job of pinning and interfering. Starting match zoning was really great though."
BH,40,B1,5804,C,FALSE,TRUE,0,0,0,3,TRUE,FALSE,0,0,0,0,1,5,2,0,TRUE,D,TRUE,0,0,4,NA,,
JJ,40,B3,3359,M,FALSE,FALSE,0,0,0,0,TRUE,FALSE,0,0,1,0,0,0,0,0,FALSE,P,FALSE,0,0,1,NA,,Missing processor shots
TC,40,R3,346,M,FALSE,TRUE,0,0,0,0,FALSE,TRUE,0,0,2,0,0,0,0,1,FALSE,No,FALSE,0,0,2,NA,5,Stunned multiple times
AY,40,B2,2534,F,FALSE,TRUE,0,0,0,0,TRUE,FALSE,0,0,1,0,0,0,0,0,FALSE,P,FALSE,0,0,2,NA,,
KO,40,R2,1731,F,FALSE,TRUE,0,0,0,0,FALSE,FALSE,0,0,0,0,0,0,0,0,TRUE,D,FALSE,0,3,4,NA,0,Started playing D 30s into teleop
GL,40,R1,401,C,FALSE,TRUE,0,0,0,1,TRUE,FALSE,0,0,0,0,0,0,11,0,TRUE,D,FALSE,0,0,4,NA,,
GL,41,R1,3373,M,FALSE,TRUE,0,0,0,1,FALSE,FALSE,0,0,0,0,0,0,3,2,TRUE,D,TRUE,0,0,2,NA,6,Multiple misses plus an instance where coral just naturally fell out of the manip. Alignment and dropping are a bit slow.
TC,41,R3,1885,C,FALSE,TRUE,0,0,0,0,TRUE,TRUE,0,0,9,0,0,0,0,0,FALSE,P,FALSE,0,0,4,NA,,Fast bot missed algae removal during auto. Good intake and fast cycle most of the time.
BH,41,B1,2186,M,FALSE,TRUE,0,0,0,0,FALSE,FALSE,0,0,0,0,0,0,0,0,TRUE,D,FALSE,0,4,4,NA,0,Good defense overall but they are a little jumpy never staying at the same coral station. 
JJ,41,B3,8230,F,FALSE,TRUE,0,0,0,0,TRUE,FALSE,0,0,0,4,0,2,0,0,TRUE,D,TRUE,0,0,3,NA,"7,6",fish
KO,41,R2,122,F,FALSE,TRUE,0,0,0,0,FALSE,FALSE,0,0,0,0,0,0,6,1,TRUE,D,FALSE,0,0,3,NA,,Failed auto but made a comeback during teleop
AY,41,B2,4638,C,FALSE,TRUE,0,0,0,0,FALSE,FALSE,0,0,0,0,0,0,6,3,FALSE,No,FALSE,0,0,3,NA,,"Coral jammed frequently, had to ram to fix"
BH,42,B1,8592,C,FALSE,TRUE,0,0,0,1,TRUE,FALSE,1,1,0,1,2,3,5,1,TRUE,P,TRUE,0,0,4,NA,,They attempted a climb but took to long 
AY,42,B2,888,F,FALSE,TRUE,0,0,0,2,TRUE,FALSE,0,0,0,0,2,2,3,1,FALSE,No,FALSE,0,0,4,NA,,
JJ,42,B3,4505,M,FALSE,TRUE,0,0,0,0,FALSE,FALSE,0,0,0,2,2,2,2,0,FALSE,P,FALSE,0,0,3,NA,,All l1 are misses
GL,42,R1,6863,M,FALSE,TRUE,1,0,0,0,TRUE,FALSE,0,0,0,0,3,4,0,0,FALSE,P,FALSE,0,0,3,NA,,
KO,42,R2,3748,C,FALSE,TRUE,0,1,0,0,TRUE,FALSE,0,0,0,0,2,5,0,0,TRUE,D,TRUE,0,0,3,NA,,I might have missed 1 auto L2
TC,42,R3,1908,F,FALSE,TRUE,0,0,0,0,FALSE,FALSE,0,0,0,0,0,0,7,3,TRUE,D,FALSE,0,0,4,NA,,"Fast cycle, lacking outake."
